{
  "schema_version": 1,
  "protocol_major": 1,
  "protocol_minor": 0,
  "capabilities": [
    {"id":"platform.events@1","request":"nai.v1.EventSubscription","response":"nai.v1.PlatformEvent","stream":true,"session_scoped":true},
    {"id":"agent.decide@1","request":"nai.v1.Observation","response":"nai.v1.Decision","stream":false,"session_scoped":true},
    {"id":"guard.check@1","request":"nai.v1.GuardRequest","response":"nai.v1.GuardResult","stream":false,"session_scoped":true},
    {"id":"knowledge.retrieve@1","request":"nai.v1.RetrieveRequest","response":"nai.v1.RetrieveResult","stream":false,"session_scoped":true},
    {"id":"memory.access@1","request":"nai.v1.MemoryRequest","response":"nai.v1.MemoryResult","stream":false},
    {"id":"skill.invoke@1","request":"nai.v1.SkillRequest","response":"nai.v1.SkillResult","stream":false,"session_scoped":true},
    {"id":"show.plan@1","request":"nai.v1.ShowRequest","response":"nai.v1.ShowPlan","stream":false,"session_scoped":true},
    {"id":"llm.generate@1","request":"nai.v1.LlmRequest","response":"nai.v1.LlmChunk","stream":true,"session_scoped":true},
    {"id":"tts.synthesize@1","request":"nai.v1.TtsRequest","response":"nai.v1.TtsChunk","stream":true,"session_scoped":true},
    {"id":"avatar.render@1","request":"nai.v1.AvatarRenderRequest","response":"nai.v1.AvatarRenderResult","stream":true,"session_scoped":true},
    {"id":"output.deliver@1","request":"nai.v1.OutputRequest","response":"nai.v1.OutputAck","stream":false,"session_scoped":true},
    {"id":"control.manage@1","request":"nai.v1.ControlCommand","response":"nai.v1.CommandAck","stream":false,"session_scoped":true},
    {"id":"storage.persist@1","request":"nai.v1.StorageRequest","response":"nai.v1.StorageResult","stream":false},
    {"id":"runtime.observe@1","request":"nai.v1.ObserveRequest","response":"nai.v1.RuntimeObservation","stream":true},
    {"id":"platform.capabilities@1","request":"nai.v1.PlatformCapabilitiesRequest","response":"nai.v1.PlatformCapabilities","stream":false},
    {"id":"platform.lifecycle@1","request":"nai.v1.PlatformLifecycleRequest","response":"nai.v1.PlatformLifecycleResult","stream":false,"session_scoped":true},
    {"id":"avatar.profile@1","request":"nai.v1.AvatarProfileRequest","response":"nai.v1.AvatarProfile","stream":false},
    {"id":"media.preview@1","request":"nai.v1.PreviewRequest","response":"nai.v1.PreviewDescriptor","stream":false,"session_scoped":true},
    {"id":"channel.open@1","request":"nai.v1.ChannelRequest","response":"nai.v1.ChannelDescriptor","stream":false,"session_scoped":true},
    {"id":"media.clock@1","request":"nai.v1.ClockRequest","response":"nai.v1.MediaClock","stream":false,"session_scoped":true},
    {"id":"audio.timeline@1","request":"nai.v1.TimelineRequest","response":"nai.v1.AudioTimeline","stream":false,"session_scoped":true},
    {"id":"embedding.generate@1","request":"nai.v1.EmbeddingRequest","response":"nai.v1.EmbeddingResult","stream":false},
    {"id":"rerank.rank@1","request":"nai.v1.RerankRequest","response":"nai.v1.RerankResult","stream":false},
    {"id":"moderation.check@1","request":"nai.v1.ModerationRequest","response":"nai.v1.ModerationResult","stream":false},
    {"id":"classification.classify@1","request":"nai.v1.ClassificationRequest","response":"nai.v1.ClassificationResult","stream":false},
    {"id":"skill.list@1","request":"nai.v1.SkillListRequest","response":"nai.v1.SkillList","stream":false},
    {"id":"gateway.invoke@1","request":"nai.v1.GatewayRequest","response":"nai.v1.GatewayResult","stream":true}
  ],
  "adapters_required": [
    {"legacy":"knowledge.search@1","target":"knowledge.retrieve@1","operation":"search"},
    {"legacy":"knowledge.facts@1","target":"knowledge.retrieve@1","operation":"facts"},
    {"legacy":"media.output@1","target":"output.deliver@1","operation":"deliver"},
    {"legacy":"ui.control@1","target":"control.manage@1","operation":"manage"},
    {"legacy":"memory.session@1","target":"memory.access@1","operation":"session"},
    {"legacy":"memory.viewer@1","target":"memory.access@1","operation":"viewer"}
  ]
}
